{
  "analyzer": {
    "name": "Mindray BS-360E",
    "model": "BS-360E",
    "manufacturer": "Mindray",
    "category": "CHEMISTRY"
  },
  "protocol": {
    "type": "HL7",
    "version": "2.3.1",
    "transport": "TCP"
  },
  "identification": {
    "hl7_sending_app": "MINDRAY",
    "hl7_sending_facility": "BS-360E"
  },
  "fields": [
    {
      "code": "CREA",
      "name": "CREATININE",
      "unit": "mg/dL",
      "normalRange": "0.7-1.3",
      "seedValue": 0.9,
      "type": "NUMERIC"
    },
    {
      "code": "ALT",
      "name": "ALANINE AMINOTRANSFERASE",
      "unit": "U/L",
      "normalRange": "7-56",
      "seedValue": 25,
      "type": "NUMERIC"
    },
    {
      "code": "AST",
      "name": "ASPARTATE AMINOTRANSFERASE",
      "unit": "U/L",
      "normalRange": "10-40",
      "seedValue": 22,
      "type": "NUMERIC"
    }
  ],
  "testPatient": {
    "id": "PAT002",
    "name": "SMITH^JANE",
    "sex": "F",
    "dob": "19900520"
  },
  "testSample": {
    "id": "PLACER789",
    "type": "CHEM^CHEMISTRY PANEL"
  }
}
