{
  "analyzer": {
    "name": "Abbott Architect",
    "model": "Architect",
    "manufacturer": "Abbott",
    "category": "IMMUNOLOGY"
  },
  "protocol": {
    "type": "HL7",
    "version": "2.5.1"
  },
  "identification": {
    "hl7_sending_app": "ARCHITECT",
    "hl7_sending_facility": "LAB"
  },
  "fields": [
    {
      "code": "HIV",
      "name": "HIV 1/2 Ag/Ab",
      "unit": "",
      "type": "QUALITATIVE",
      "possibleValues": ["NEGATIVE"]
    },
    {
      "code": "HBSAG",
      "name": "Hepatitis B Surface Ag",
      "unit": "",
      "type": "QUALITATIVE",
      "possibleValues": ["POSITIVE"]
    }
  ],
  "testPatient": {
    "id": "PAT003",
    "name": "RAKOTO^JAO",
    "sex": "F",
    "dob": "19850412"
  },
  "testSample": {
    "id": "43",
    "type": "IMMUNO^IMMUNOASSAY PANEL"
  }
}
