{
  "analyzer": {
    "name": "Cepheid GeneXpert",
    "model": "GeneXpert",
    "manufacturer": "Cepheid"
  },
  "protocol": {
    "type": "HL7",
    "version": "2.5",
    "transport": "TCP"
  },
  "identification": {
    "hl7_sending_app": "GENEXPERT",
    "hl7_sending_facility": "LAB",
    "ip_pattern": "192.168.1.*"
  },
  "fields": [
    { "name": "MTB", "code": "MTB", "type": "QUALITATIVE", "possibleValues": ["Detected", "Not Detected", "Invalid"] },
    { "name": "RIF", "code": "RIF", "type": "QUALITATIVE", "possibleValues": ["Resistant", "Sensitive", "Indeterminate"] },
    { "name": "Ct", "code": "CT", "type": "NUMERIC", "unit": "Ct" }
  ],
  "testPatient": {
    "id": "PAT-GX-HL7",
    "name": "Rakoto^Jean^A",
    "sex": "M",
    "dob": "19850315"
  },
  "testSample": {
    "id": "10",
    "type": "ORH^Other"
  }
}
