{
  "analyzer": {
    "name": "Mindray BC2000",
    "model": "BC2000",
    "manufacturer": "Mindray",
    "category": "HEMATOLOGY"
  },
  "protocol": {
    "type": "HL7",
    "version": "2.3.1",
    "transport": "TCP"
  },
  "identification": {
    "hl7_sending_app": "MINDRAY",
    "hl7_sending_facility": "BC2000"
  },
  "fields": [
    {
      "code": "WBC",
      "name": "WHITE BLOOD CELL",
      "unit": "10^3/uL",
      "normalRange": "4.0-10.0",
      "seedValue": 7.5,
      "type": "NUMERIC"
    },
    {
      "code": "RBC",
      "name": "RED BLOOD CELL",
      "unit": "10^6/uL",
      "normalRange": "4.0-5.5",
      "seedValue": 4.82,
      "type": "NUMERIC"
    },
    {
      "code": "HGB",
      "name": "HEMOGLOBIN",
      "unit": "g/dL",
      "normalRange": "12.0-17.5",
      "seedValue": 14.2,
      "type": "NUMERIC"
    },
    {
      "code": "HCT",
      "name": "HEMATOCRIT",
      "unit": "%",
      "normalRange": "36-54",
      "seedValue": 42.0,
      "type": "NUMERIC"
    },
    {
      "code": "PLT",
      "name": "PLATELET COUNT",
      "unit": "10^3/uL",
      "normalRange": "150-450",
      "seedValue": 250.0,
      "type": "NUMERIC"
    }
  ],
  "testPatient": {
    "id": "PAT004",
    "name": "DOE^JANE",
    "sex": "F",
    "dob": "19860720"
  },
  "testSample": {
    "id": "44",
    "type": "CBC^COMPLETE BLOOD COUNT"
  }
}
